発話者2,応答者2,対話行為,対話行為2,感情
そやけどＢちゃんはな、ここにいてるときはな、まあゆうたらそういう生活、やっとったわけよ。それが今のマリエッタ状況になると、困るか、フラストレーションかどっちかやと思うが、全然そんなことなかったな。。,あの子、そやけどそん、そんなに、そ、そういう状況というか、そんなに幸せ、幸せていうか、したいようなタイプの子と違うんやと思うわ。あの子そんな友だちとぶらぶらどっか行ったりせえへんやん。おおつ、Ｇやわ、む、むしろ。そのぷらっぷら型は。そやけどそのー、すごいやっぱり家族のあれやねんやと思うわ。家族教育的やねん、もうアメリカ。日本に比べて。,自己開示,自己開示,悲しみ
あ、違うわけ。,水着も入りたいときは、１７００円ぐらい払って、全部。温泉だけのときは、忘れちゃったけど、なんか３００円とか、６００円とか７００円とか払うんじゃない？忘れちゃったけど。で、入って、温泉入って、それで出てきて、で、帰りにおそばだと思って行ったら、もう閉まってた。おそばが売り切れたら、閉まっちゃうんだね。だから、だめだった。そしてその。,自己開示,応答(平叙),悲しみ
自分がフランス行ってたからって、わたしは大丈夫。,えきは疫病の疫でしょ、口蹄疫っていうのがはやってて、だからなんかその、なに、乳製品のー輸出入に、すごいあのー敏感になってたわけよね。敏感、過敏？過敏になってたわけよー。,自己開示,自己開示,悲しみ
はいはいはい。ああ、じゃあそれで起きればいいじゃないですか。,うん。で、今何時かなあと思ってこう見て、９時か８時半なんですよねえ。あ、これはもうちょっと寝ないといけないかなあとか思って、寝ちゃうんですよね。,自己開示,あいづち,悲しみ
いいかもしらん。,やるの。そうするとね、１キロぐらい減るよ。,自己開示,自己開示,悲しみ
私爽健美茶だと思いながら飲んでたけど、ずっとおかしいやーって思いながら飲んどったのー。,私、お金ちょっとでも切り詰めようと思って、使い終わったペットボトルに作ったウーロン茶を詰めてるんだ。,自己開示,自己開示,悲しみ
留学に行ったのは大学院出た後、ちょっと教えてからだったから20歳半ばくらい。,もう２０代後半だったわけでしょう？,自己開示,確認,悲しみ
何もりっぱなもんできてない。何もりっぱなもんできてない。ほいでね、やっぱり手編みのセーター、自分の編んだセーターなんかね、普段着しかできないわよ。,でも軽いし、あったかいし。,自己開示,自己開示,悲しみ
どうしよう、もうさあ。,こないだもさー、栄行ったときに買おう、買ってってあげようかと思ったんだって。,自己開示,自己開示,悲しみ
そのー。,パソコンよくわからん。,自己開示,自己開示,悲しみ
名古屋なんか降ったら、ほんとにまひしちゃうもんね。そんなもの用意してないから。,びっくりしちゃうだろうね。,自己開示,自己開示,悲しみ
たぶん助手席と後部座席の作りは多少違うと思うんだわ。,私乗るときまたぶつけるような気がする。,自己開示,自己開示,悲しみ
かかり、ま、かかるけど、車とかバイクとかよりかかんねえ。,いや、それはそうだ。いやこの、あたしつけた。,自己開示,あいづち,悲しみ
私とか、わざわざ編入してきたんだからさ、もう動物関係ばりばりやった方がさー、いいんだけどさ。みんななんか、そんな頑張んなよ、みたいな感じだからさ。私とかは頑張って恥ずかしいなって感じ。頑張ってないよって感じにしてる。,ふーん、そうなんだ。でも大変そうじゃん、授業、なんだっけ、解剖スケッチだっけ。,自己開示,あいづち,悲しみ
そう。,大丈夫だよ。,自己開示,自己開示,悲しみ
うん、無理矢理だろう、それは。年末年始の休みにー、その前の週のその、その,休みを使って。,自己開示,自己開示,悲しみ
大学で教授目指す道って大変な気がする。なんか、ほら、それこそさ、リターンが入るまでにすごく時間がかかるじゃん。,そうだよね、そうそう。,自己開示,自己開示,悲しみ
えでもやっぱり悪いから言えないかもしれない。,うん、そうだね。,自己開示,自己開示,悲しみ
終戦すぐ？,うん。ああ。あのー阿佐ヶ谷は空襲されなかったから。帰ってきたわけ。,自己開示,応答(YesNo),悲しみ
そうかー？でも、私、３日もなかったよ、もう。なんか、なんか知らないけど、やっぱり真ん中って損だわ。,そうかなー。でも、うちはあれだからなー。真ん中は男だからなー。うーん、なんかちょっと違うかも。,自己開示,自己開示,悲しみ
授業の練習をするって、そこの項目の教え方がどうこうとかっていうこと以前に、すべてが半端みたいなところもあるしさ、なんか難しいよね。,雲つかむような話だよね。,自己開示,自己開示,悲しみ
はあ。,だから、ＩとＮって言ってね。,自己開示,自己開示,悲しみ
そんなにすんの。,え、あれ？国立って、年間いくらの授業料？俺、授業料免除もらってっから、よくわかんないんだよ。払ったことないもん、授業。,自己開示,フィラー,悲しみ
でも、そうでもないんですよね。,あ、そう。あった？仕事。,自己開示,あいづち,悲しみ
うん？,１１年、死ぬことも予定の１つ目、これは、１３年。ね。ふっと感じたことを引きとめとくの。ね。これ、これＫ君が生まれたとき。秋晴れやひ孫の産声元気よく。,自己開示,応答(平叙),悲しみ
アトラクション待ってる間に流れる説明みたいなやつ、覚えてないの。,うそー、そうだったっけ、あー。,自己開示,自己開示,悲しみ
なんで、いいじゃないですか。,もうなんか。,自己開示,自己開示,悲しみ
恥ずかしいよね、あれ乗るの。,あれは無理だろ。,自己開示,自己開示,悲しみ
あー、そっかそっか。Ｊ君、どうしてるかねー。,＜笑＞いや、酒飲んでるよ。,自己開示,自己開示,悲しみ
でもさ、もともとはあんどんとか使ってたわけでしょう。それをなんとさ、なんであのあんどん文化が残ってないんだろうと思って、うん。結構最近さ、外でさ、こ、なんていうのー、あの、焼き物で焼いたのとか和紙で作ったので売ってるじゃない。だからああいう売ってるのは見るといいなと思うんだけど、はたしてそれを買ってきて合う部屋があるだろうかって考えると、ないし。,ないよね、なんか目が悪くなるみたいなのが強いんだよねー。,自己開示,自己開示,悲しみ
行けるんじゃないの、Ｗとか。。,もーうちょっとなんかまともにならないのかなあ。学生に。だから、学生ってなると、ようやくＣ２さんが１人入ってきて、うまくやってるぐらいで。,自己開示,自己開示,悲しみ
南の方なら。,そやからその日本との直行便飛ばして、アトランタと成田間ね。,自己開示,自己開示,悲しみ
まあねー。だからあんまり薬飲むのもよくないしー。,そうだね、副作用あるし。,自己開示,自己開示,悲しみ
うん、それはそうだね。,うーん。でもー、ほかはどうなんだろうって思った。,自己開示,あいづち,悲しみ
そうそうそうそう、何かこう、何かが近づいてきてそれをこうつかんだ瞬間にもう遠くに行っちゃってっていう感じだよね。,こんなことじゃあっという間に４０だよ。,自己開示,自己開示,悲しみ
うん、でもさー、春になったらまあ１歳だからー。,うん、だから平気だと思う。,自己開示,自己開示,悲しみ
そんなに荒いかなあ。,荒い。実感したね。,自己開示,応答(平叙),悲しみ
いいじゃない。,消し、消して。,自己開示,自己開示,悲しみ
うん、無理。もうさー、昨日とか、あ、違う、おとといとかすごい暑かったからさー、朝起きて窓開けたらさー、もうすでにクーラーなしではいられない気温になってたからさー。,なんか、それに熱風が吹いてくるじゃーん。,自己開示,自己開示,悲しみ
わたしサマースクールでいくらもらってたか覚えてないけど。,うん、結構もらってたでしょう？,自己開示,確認,悲しみ
来ないですよねー。,うん。最初はまあ研究職、いいなあーと思ってたんですけどー、やっぱり、大学院に入ってから、ねえ、現実が見えてきたっていうか。,自己開示,応答(YesNo),悲しみ
でも、できない、できない学生にはつらい。ねえ。,つらいでしょう、ね。,自己開示,自己開示,悲しみ
いないですよねえ。,身近にいたら本当にいいなーって思うんですけどねえ。,自己開示,自己開示,悲しみ
顔も嫌いだった。,お前、なんだお前は。,自己開示,自己開示,悲しみ
わーすげー、この画面見てたら目が痛くなる。,極彩色っつーか迷彩色だよね、これどっちかっつーと。,自己開示,自己開示,悲しみ
ありましたねえ。,何か連続で。,自己開示,自己開示,悲しみ
そりゃ出るわねー,びっくりだよねー。,自己開示,自己開示,悲しみ
うーん。そういうのないと。名詞出さないでしゃべるのが難しい。,難しいっていうか、そういう気の遣い方ができない人。なんかそういうこともできなきゃいけないって思うけど。,自己開示,自己開示,悲しみ
うん、全然違うよね。,かわいくない。,自己開示,自己開示,悲しみ
あー、あっ、でも上に着るで別にいいかなとか思う。,そう、なのに、さ、だめなのね。こう、固定観念が。,自己開示,自己開示,悲しみ
あー、そうなんだ。,あっ、わからん。っていうか、だめかもしれんじゃん、来年とか。,自己開示,自己開示,悲しみ
ここで、じゃあ助けるって言っていいの。微妙。うーん。,そういえばさ、こないだ、Ｅ２からさあ、Ｔさんとの、あの、話を聞き出しとってさあ、おもしろかった。,自己開示,自己開示,悲しみ
そう。,えーでも驚かしても死ぬよー。ほう、だって。,自己開示,自己開示,悲しみ
まあ自分のことしか考えてない人間だから、うちの息子は。それと今ちょっと仕事がね、変わったんですよ。だから、何かすごく忙しいらしいのね。またこれで結婚が遠のくなあと思っちゃってるんですけど。結婚しないのって本人のためにはどうなのかなあと思って。,そうですねえ。,自己開示,自己開示,悲しみ
ああ、そっかー。,たためるかなー、もうー。,自己開示,自己開示,悲しみ
そうなんだよねー。いくら歌がうまくってもさ、やっぱ見た目とかあるよねー。,うーん。かわいそうだよ、もう。,自己開示,あいづち,悲しみ
そうですね。,だから毎年応募してて、その１０年目ぐらい、だんだん順位が上がっていって、で、あの、一番上になった人が選ばれるみたいなんですよね。,自己開示,自己開示,悲しみ
それはそれぐらい掛かるんじゃない、人件費からさあ、材料費から、全て。,設計から。,自己開示,自己開示,悲しみ
あーそう。,これが俺だって言われた。,自己開示,自己開示,悲しみ
だめ。,でもそんなことをしたら、数学なんか全然。,自己開示,自己開示,悲しみ
若い時ってすごい無鉄砲だしさー。うーん。,後先考えないで行動するよね。,自己開示,自己開示,悲しみ
何か、私自身で時間の使いかたすごい下手だなあと思って。,難しいですよね。,自己開示,自己開示,悲しみ
だから１８か２０歳まではということやろ？。,でもその１６になったら車に乗って動けるようになるんやから、ある、ある程度は。うん。１人で何でもできる、動ける。でもそこまではもう完全にあれやわ。もう、んー、移動の自由がないねんから、ひどい話。,自己開示,応答(平叙),悲しみ
全然覚えてない、人のことは。,うん、人のことは全然覚えてない。今年じゃなかったよ。,自己開示,自己開示,悲しみ
私は買う気ないしさー、別に着ないし。,ねー、お母さんがさ、なーお前、一生のもんだから買ってあげようかと言われたんだけど、どうしようとか思って。,自己開示,自己開示,悲しみ
ふーん、あごめんなさい。,もともとの日本語の大半は自分が書いたやつやから、結構楽やっちゅう。,自己開示,自己開示,悲しみ
うん、うん。たら、そのファイルだけ今消す？じゃあ。,そしたら、もう、だれもやらなくなるかなー。,自己開示,自己開示,悲しみ
うん、医学部出すのも結構痛いし、痛いじゃん。私大、よく私大とかだったし。,そう、６年通うのもさ、何千万とかするんでしょう？やばいよね。無理なんだけど。,自己開示,確認,悲しみ
ま、そりゃそうですよねえ。,うーん。確かにそのー、昼間も寝てるとは言ってもー、体力は使ってるみたいだよね。,自己開示,あいづち,悲しみ
今日はやーい。あっという間に夕方になっちゃったって感じ。,まだあってそんな経ってないじゃんて思ったけど、あー、そんなことないか。,自己開示,自己開示,悲しみ
そう。三重県。三重。書けないよ。もういいね、三重県までで。,あ、三重郡。三重郡なんだ。菰野町。,自己開示,自己開示,悲しみ
でも、大変でしょ。,うん、赤ちゃん。,自己開示,自己開示,悲しみ
うわ、ほんとひどいよねー。,ちょ俺、うそと言い訳嫌いやからね。ひどくないよ、別に。,自己開示,自己開示,悲しみ
寝れん。,でもこのぐらいの音だったら、寝るかもしれないね、犬も。,自己開示,自己開示,悲しみ
生活習慣のために。,すごいねー。,自己開示,自己開示,悲しみ
ただ単にだから身内にいい顔をしたいってだけのさ、ことかと思ってさ。,ほんとね、へー。,自己開示,自己開示,悲しみ
民間の日本語教育学校の時給は１０００円台がほとんどだよー。,えー、ほんとにー。そんなん、普通のバイトやっていた方がよっぽどいいじゃーん。,自己開示,確認,悲しみ
あー、違います。,ああ、違う。いや、バイトでそっちの方は行くんですけどね。,自己開示,自己開示,悲しみ
え、もうそろそろ終わりにしろっていうことかな。,確かそんな気がします。話せました。,自己開示,自己開示,悲しみ
うん、そうだもね。,だってさ、こないだ、ともだ、友達というか、まあ、Ａさんと話してて、何かを教えてもらってたのね。ほいで、それは結局もうボツになったんだけど、あ、ほんと、このお礼は、ほんとにさせていただきますっていったら、体で払ってもらおうかって。おいおい、そんなこと言うなよーとか思って。ま、いいんですけどね。危なかった。一瞬それを２人とも忘れてて。,自己開示,自己開示,悲しみ
ちゃんとクレーまでも対応できたらいいけどね。,嫌だなー。,自己開示,自己開示,悲しみ
仕事ができるのと仕事に慣れるのは違うのよ、あなた。,もう、そういう何、理屈はいいからー。,自己開示,自己開示,悲しみ
読めないとは言わないけど、なんか持っててもなんか持ってるだけ、あーって感じかもしれない、なんか。,あたしよりできない学生さんに会うなんて。,自己開示,自己開示,悲しみ
うん。いや、べつに先生になるわけじゃない。,いや、そういう予備軍っぽい人いっぱいいるよね、なんか。嫌だなー。,自己開示,自己開示,悲しみ
うーん。まあおっさんでしょうねえ。,でもまあおっさんだけど幼いやろうねえ、まだ。なんかそんな気がする。,自己開示,自己開示,悲しみ
あ、そう。,たぶんね、Ｇちゃん覚えてると思うよ、一番当たってたもん、私。,自己開示,自己開示,悲しみ
胃が痛くなるんだよ、意外かもしれんけど。,それ、しゃれじゃねえって。,自己開示,自己開示,悲しみ
私は一日２回しか食事をしないの。,あらまあー。わたしは、たくさん食べられないけどすぐお腹が空く方なの、昔から。,自己開示,フィラー,悲しみ
あ、そう。,ものがない時代。今はもう造れない技術だって。追い詰められなきゃ造れないみたい。,自己開示,自己開示,悲しみ
その、飲食店でええんちゃうかなと俺は思ったんやけどな。,あ、飲食店か。,自己開示,自己開示,悲しみ
それは、だってしょうがないんじゃない。１クラスもらうんだから。,そう、だから、今年もやっぱり月曜日の、あの例のパターンで週の途中、火曜日ぐらいかなんかはさあ、なんかそういう感じみたい。,自己開示,自己開示,悲しみ
あ、そうかな。うん。,でも、まあ、人には言えるけど私もそんなできないけど。,自己開示,自己開示,悲しみ
曜日書いてないな。,明日はクリスマス・イブか。,自己開示,自己開示,悲しみ
あるかなー。うん。,あげる気ないよって。,自己開示,自己開示,悲しみ
スカート。入らん。,いいやつを買う。,自己開示,自己開示,悲しみ
今日、レ、レバニラ食べればよかったじゃない。,あ、うそ、あったんだー。,自己開示,自己開示,悲しみ
。,そうだなあ、何だかそこらんとこはねえ、もう、ごっしゃごしゃんなっちゃって、わかんない。まーったくねえ。,自己開示,自己開示,悲しみ
。うん。それしかわからない。自分がほら、行く場所しかわからない。,うんうんうんうん。なんか昨日さー、塾にー、あれ書きにいったの。冬期講習のー、今持っている担任の生徒のね、予定表を書かなくちゃいけないの。,自己開示,あいづち,悲しみ
だー。,半分よりは前かちょっと。,自己開示,自己開示,悲しみ
買いたくもないわね。へえー、あ、そーうなのー。,その点、ハーモニカもやってんだけど、ハーモニカの先生も女性なんだけど、ハーモニカ協会賞とかいうのもらっておもらいになって、こっちのもお祝いしたんだけどやっぱりパーティがあって、い、行ったら、あの、こんなブローチ、ビーズでできたブローチをあの、こんなかわいらしい紙、手さげ袋に入れて、全員に配ったのよ。これじゃ足が出ちゃうんじゃないって、言ったんだけど。,自己開示,自己開示,悲しみ
ちゃうよ。世間が育ててくれるという感覚というのが全くないわけよ。世間というのはその、１００％ネガティブなもんなんや、まず。な。,まあね。そやけど、そやけどそのわりにそやって、おお、Ｂみたいなそんなわけのわからんような子ーだって引き受けるから。日本やったらそんなん引き受けへんと思うよ、そ、その辺また全然違うと思うよ。で、引き受ける人もそらなかにはあるやろけど、そんなん簡単に引き受けへんよ。,自己開示,あいづち,悲しみ
たためないって。,洗濯物乾いてないもんね、あんまり。,自己開示,自己開示,悲しみ
よけいなお世話しちゃったこと？思い出した。なんか先取りしすぎちゃった話なんだけど。中学のときの話なんだけど。ある子が持ってきた氷が残ってたらしくって。別にその子は残った氷あげようと思ってなかったのに私、いらないよーとか言っちゃって。すごい恥ずかしくってさー。,もらえるかわかんないのにー。,自己開示,自己開示,悲しみ
まちがいないね。お客さんもそれわかってるから、いんじゃない。あーあ。,久しぶりに運転するけど、低い。ちょっと怖い。いつも、,自己開示,自己開示,悲しみ
メジャーリーグなんかもあの解説してる人がこう、皮肉っぽく、湿っぽく言う人だとおもしろくないわね。,そうよね、ほんと。あんまりそして、皮肉ばっかり入れてねしゃべるとおもしろくないですよね。,自己開示,あいづち,悲しみ
もうそんなにたつ？,６時だから。なんか、F131に悪いからさ。,自己開示,応答(平叙),悲しみ
ちゃう。,そっかー。お好み焼き・焼きそばって感じなんやけど、キャベツといえば。,自己開示,あいづち,悲しみ
それ次第だよね、ほんと。結構うまくいかなかったとか言ってたけど。,言ってたねー。あーどうしよう。私もう、こう、理論的なやつは書いたんだけど、Ｂ先生の。理論ていうか、こうこう、,自己開示,あいづち,悲しみ
ものすごーく、最初の部分というか、根本的なところで違いそうやから、違うというか、ちょっと違ったとしても。,でも、何かはまだわからない。でも、いろんな点でやっぱり考え方が。それは個人レベルのこともあるだろうし、その国の違いもあるんだろうけど。,自己開示,自己開示,悲しみ
でもＢさんの方には出てるのね。でも私の方には全然来ないの。,えーっ、なんかほかの授業入れてるんじゃないのとか、思っちゃうよね。,自己開示,自己開示,悲しみ
うん、うん、それは嫌ね。それなあに？カルチャーセンター。,うーん、やっぱり同じ東急。日本のものってどうもそういうとこがあるみたいね。,自己開示,応答(平叙),悲しみ
私も直さないかも。,俺は直すよ、いつも出るとき。,自己開示,自己開示,悲しみ
うーん。ふーん、そっか。うーん、確かにね男の人へのプレゼントは、困るよね。うーん、そうだねー。,うん。あのー、旅行に行ったときのお土産にも困るし、女の人だったらまだねー。,自己開示,あいづち,悲しみ
あーなんかねえ、ごめんね。もう今日うちだれもいなくてさー。,だれもおらんかったな。なんでや。めっちゃ、しーんとしとるがや。,自己開示,自己開示,悲しみ
お腹周りが。,そうそう、なんかね、バイトするとね。,自己開示,自己開示,悲しみ
ええ、手が進みませんよ、そんなに。,ここでいつもやってらっしゃる。,自己開示,自己開示,悲しみ
太るから。,すごい気を遣ってらっしゃいますよ、食べ物に。,自己開示,自己開示,悲しみ
彼氏、また一年って何にもしなかった。で、今の状態で、やっぱり無理だわとか言い出して、もう私あったまきちゃってさー。もうねえ、見捨てるからっていうメールをね打ったの。今までどうもみたいな。,私は私でやるよ、もう、みたいなメールね。,自己開示,自己開示,悲しみ
もうそろそろなんか始めないと。,それとなんかピンポンとか行っててね。市民。,自己開示,自己開示,悲しみ
ほんまやって、もうー。隠せ、隠せーって感じだったもん。Ｃの目に触れんところに行こー。,手巻きずしとかさー。,自己開示,自己開示,悲しみ
長いことーやってたし。,そう。だからその経験っていうのはね、すごいですよね。だからさわってわかるわけでしょう。,自己開示,フィラー,悲しみ
