発話者2,応答者2,対話行為,対話行為2,感情
へーえ。,最初１００人でー、で、半分過ぎたときにまた後期のお金を集めるっていうんで、でもそこでね、３０人くらいかな。先生はもう最終的に３０人ぐらいしか残んないんじゃないかと思ってたらしいんだけど、全然すごい６０人とか７０人ぐらいはいるかな。,自己開示,自己開示,嫌悪
へーえ。,だから作家さんが書いたときに最初にこの本はこのアイマークっていうのをつけて、だれでも読み聞かせをして、それにテープとかを販売してもいいですよっとかっていう本がかなり限られてるんだって。,自己開示,自己開示,嫌悪
ふーん。,だからそういうのにどんどんね、本を発行されるたびにこういうアイマークををつけてくださいっていうみたいな運動の。,自己開示,自己開示,嫌悪
まぬけ。,ティースプーンだ。めちゃ、めちゃ食べにくい。,自己開示,自己開示,嫌悪
だから同じ言葉を表現しても全くそれが何かわからない人と、ああ、ああいうものあったなっとかって、そんなの違いもあるって言ってた。,そっかー。,あいづち,あいづち,嫌悪
うーん。,でもねー、実際やってみないことには、だめだもんねー。,自己開示,自己開示,嫌悪
そうだよねー。うん、言えてる。,ねえ。,あいづち,あいづち,嫌悪
うーん。,ふーん。,あいづち,あいづち,嫌悪
あ、やめてーっって思っちゃう感じ？わかる、わかる。そうだよねー。,いや、あのー。,あいづち,あいづち,嫌悪
うーん。,私はすごい頑張ってると思うんだー。,自己開示,自己開示,嫌悪
いろいろのいから。,夢見る夢子だったことがない。夢見る夢子だとしても、見せないようにしている。,自己開示,自己開示,嫌悪
若い子言うのやめなさい。,いや、ほんとにおもしろいんだって。さんはなんか笑ってばっかりいますねー。人生楽しそーとか言われちゃってさ。,自己開示,自己開示,嫌悪
そんなん、あたしがフランス人っていうことを言っとかないと。だから日本語がおかしいっていうことも。,あっ、そうだ、そうだ。フランス人とかっていう、あのー、詐称がないようにこれを書いてもらうことになってるのー。,自己開示,自己開示,嫌悪
聞いてない話ばっかじゃーん。,ありがとー。ううん、そんなことないよ。,自己開示,自己開示,嫌悪
そーんなー。こんなん、うそじゃん。だってプライバシーにかかわる参加者の氏名、固有名詞等は伏せてって書いてあるけどさ。,うん、だから中身について。,自己開示,自己開示,嫌悪
Ａじゃないとだめなの？,うん、Ｂでもいいけど、Ａ、Ａ。どっちでもいいよ。,自己開示,応答(平叙),嫌悪
いないもん。あの人は違うもん。養母だもん。じゃなきゃ、あんなに私に冷たくするわけないじゃん。,さっきやさしかったよー。,自己開示,自己開示,嫌悪
やってもらうのが絶対嫌って。,ああ、そうなんだー。,あいづち,あいづち,嫌悪
ほんとに。,ケーキセットないのかな。,自己開示,自己開示,嫌悪
そんな。これには触れないでください。,わかった。あー、なんか、すごい歩き回っててて疲れちゃった。,自己開示,応答(平叙),嫌悪
あ、ほんとに。,うん。,あいづち,あいづち,嫌悪
自分の、あ、親戚とかいるんじゃなくってー。,うん、いない、いない。,自己開示,自己開示,嫌悪
うーん。,そー、だからなんか、私もお姉ちゃんとさ、お姉ちゃんもお母さんもさ、ちょっとなんか全然変わったよねとかいってさ、びっくりしゃうねとか言って。,自己開示,自己開示,嫌悪
ふーん。,パティシエの方ね。,自己開示,自己開示,嫌悪
うーん。,カブはなんかさ、なんかどろどろどろってなるじゃん。私あの食感がどうしても嫌いでさー。,自己開示,確認,嫌悪
ふーん。,お正月作ったよ。,自己開示,自己開示,嫌悪
うーん。,私なんで１月１日にトイレ掃除とかしなきゃいけないんだろうと思ってさー。,自己開示,自己開示,嫌悪
ふーん。,なんかね、去年もそうだったような気がする、なんか。,自己開示,自己開示,嫌悪
ふーん。,ま、要するにスポンジ。,自己開示,自己開示,嫌悪
ふーん。,でも鳥ぐらいの視力で見たらきれいに見えるんじゃない、きっと。,自己開示,自己開示,嫌悪
へーえ。,あんなに降ったことないよ、今まで。,自己開示,自己開示,嫌悪
へーえ。,何ごとやーっと思ったら雪おろしとった。,自己開示,自己開示,嫌悪
うそ。そんなことない？,ならない、私。このぐらいじゃあ。,自己開示,応答(平叙),嫌悪
どーしよーね。,いかんやん。じゃ、あとで。,自己開示,応答(平叙),嫌悪
ふーん。,たぶん今忙しいから。残業あるから、じゃ、あとでメール送ろう、じゃあ。会社のメールと。,自己開示,自己開示,嫌悪
あー、そうだね。でも中途の採用って別に関係ないじゃーん。,うん、そう、そう。ま、別にー、就職だけじゃなくって、まあ、ドクターに進むとか、いろんな道があるけど、就職するならていう話で。でさ、またさ、なんか、リクルートのリクナビとかさ、エントリー・シートとかさ、そういう話聞かされてさ。,自己開示,自己開示,嫌悪
でも、でも別にさーあ、あのー、あれなんだけどー。,なーに、またそんなたの。すごいF101ちゃん。,自己開示,自己開示,嫌悪
そかなー。,５００円でしょう。５００円って一応いろいろ食べれる。５００円あったら。,自己開示,自己開示,嫌悪
うーん。,うん。,あいづち,あいづち,嫌悪
あー、そっかー。,うん。,あいづち,あいづち,嫌悪
うち、そういうふうにもならない。勝手にしなさいいうふうにはならないもん、うち。そうなんだ。,うん。,あいづち,あいづち,嫌悪
嘘だー。,結婚したん、結婚したらしいよ。,自己開示,自己開示,嫌悪
あれはもう別居って。,もうあれは、あの前の奥さんとは、もう離婚も成立して、で、なんかＢちゃんが、いつだったかな、新年早々なんかメール来て、ラックスのＣＭを見てたら、こないだまでそのベネロ、ベネロペ・ク、クセスかなんかわからんけど、だったのが、ベネロペ・クルーズになってたっていうのね。,自己開示,自己開示,嫌悪
へーえ。,別に結婚しなくてもいいのにねと思ってさ。前に前、失敗したら結婚しなくてもいいよね。,自己開示,自己開示,嫌悪
うーん。,で、あのー、バニラ・スカイの、バニラ・スカイってもともとスペインの映画なんでしょう。,自己開示,自己開示,嫌悪
へえー。,その、いつから歌うって始めたのか、ずっとダンスだったから。あれっ、この人たちダンスの話してるのかなと思ってさ。歌歌うんだ、やっぱり。確か歌うたっているはずだと思って。,自己開示,自己開示,嫌悪
へーえ。,昔っぽいようなー。,自己開示,自己開示,嫌悪
うーん。あとで全然聞かないやつもね。,ね、私もあるわ。,自己開示,自己開示,嫌悪
で、そのままなんか、あの、置いといたらさ、箱の中とか入れといたら全然聞かなくってさ。,ある。そういうの。,自己開示,自己開示,嫌悪
で、だけどー、それ手に持っても聞きたいと思わないからー、また戻すのよ、箱に。,わかる。わかる。そういうのあるもん。私。,自己開示,自己開示,嫌悪
なんかすごいねー、うちの大学保守的でね、腹が立ってくる。すごいね。,すごい、すごいチーズの濃度が高そうだ。,自己開示,自己開示,嫌悪
なんでー。,まず。,自己開示,自己開示,嫌悪
私もねー、人のこと言えんよね。。,そういうものは全然、、全然。,自己開示,自己開示,嫌悪
もうずっと？教授？もしかして。,ううん。なんで、なんで。自動的にそうはならんて。,自己開示,応答(YesNo),嫌悪
へー。なんかさー、なんか、私とかからするとさ、どういうふうに客観的に、その、評価するかわからん。F004たちみたいな分野。,論文の本数とか。,自己開示,自己開示,嫌悪
いやいや。,いやいや。うん。,あいづち,あいづち,嫌悪
ふーん。なんでだろーねー。こんないいやつなのにね。,わけわかんない。ま、いいか。大丈夫、大丈夫。,自己開示,応答(平叙),嫌悪
あ、強制なの。,F004を行かせる。,自己開示,自己開示,嫌悪
診察台の上でこう。先生に取り出してくださいって。そう、なんか、自宅通いの女の子は、採ってない、あっ、自宅通いの人は採ってないとかって、なんか、家族に迷惑がかかるからとか。夜遅くなって。どんだけ遅くなるのって感じがする。そんなんだったら、子どもなんかいたらとんでもないって言われそうだなーって。,うん、そうだね。えー、大変そうだねー。,自己開示,あいづち,嫌悪
成績が結構いいじゃん、獣医って。で、人間の医者落ちたからっていう人も多くってさー。だからあんまり動物好きじゃないっていう人もいるし、なんか、結構ねー、みんな、みんなそんな動物おたくじゃないしねー、普通。むしろなんか、経済学科にいたときより、みんな今風みたいな。あたりまえだけど。,へー。ま、今だからね。,自己開示,あいづち,嫌悪
あー。,昔みたいに、その、ゆっくりティータイムをときは。,自己開示,自己開示,嫌悪
そうだよねー。こういうものなんだーって。家族にも知らせなきゃって。,うん、へー。,あいづち,あいづち,嫌悪
知ってるから、どうしたらあったかいとかわかるから、もちろんそうするけどって。,なんか、説得力あるね、Ｈ先生。,自己開示,自己開示,嫌悪
わからないけど。,へー。やっぱ日本海側だからね、すごいだろうね。,自己開示,あいづち,嫌悪
あー。,日本にいたい？それとも。,自己開示,質問(YesNo),嫌悪
そっか。そういうこともあるんだよね。だって、私やってないからしかたないもんって言えない。,とは言えない。,自己開示,自己開示,嫌悪
言いにくいとこってあるかなー。,うん。,あいづち,あいづち,嫌悪
うん。だってそれは、たぶん先生っていう仕事だから、よけいなんだろうね。これが事務とかだったら、もっとなんか、割り切れるじゃない。だって特に、あの、何かの、ちゃんときちんと。,その場で、変な失敗とかしなければ。,自己開示,自己開示,嫌悪
入れなきゃって。,うん。いたるところになんか、いっぱい。,自己開示,あいづち,嫌悪
きっちり。,結構埋まってる。,自己開示,自己開示,嫌悪
違う、でも、いつが寒いとかのさ、判断はさ、だれがするわけ？それさ、問題じゃない？,雰囲気。今日、さむ。,自己開示,応答(平叙),嫌悪
うん。でも玄関に、何か、どこでも問題だよね、実際ね。玄関に置いたら、玄関に置いたで、何か、何？せまいし、靴とかが臭くなるしね。,うん。人が入ってくるとこでしょう。あそこ一番におうんだよね。,自己開示,あいづち,嫌悪
あるあるある。めんどくさいじゃん。,あのー、一部お金をね、もう持っていかないといけないんだわ。,自己開示,自己開示,嫌悪
いつまでですかとかいって？,うーんと、３０万、３０万出してー。,自己開示,自己開示,嫌悪
あ、じゃあさー、何、ここにこれあるんだから、これ。いやー。,人にはわからないから。,自己開示,自己開示,嫌悪
だめじゃん、全然。全くだめよ。,書いてある。じゃあだめだね。じゃあ、なし。うーん、４６、５４。,自己開示,自己開示,嫌悪
うん、でしょう。うん、絶対だめよ。,だから２月に行くんだけど、準備があるじゃんね。だから２月の中旬ぐらい出発でいいかな。どうせ４日間だもん。,自己開示,自己開示,嫌悪
あれ、これはれるやつ？こないだの。,はれるよ。さー、お母さんしか持ってないの。,自己開示,応答(平叙),嫌悪
いやー、やっぱり子どもから、子どもっぽい、それ。,何か、目はれてるね。何だろう。これ。ちょっと何、太ってたね。,自己開示,自己開示,嫌悪
あー、こっちああるわ。,うん。,あいづち,あいづち,嫌悪
うん。でも捨てれんねえ、あのー物理とかさ、微分とかのノートとかさー。あのー、,一生懸命やったのに。,自己開示,自己開示,嫌悪
さーって読んでっていうか大事そうなところだけ、全文読まないで大事そうなとこだけ抜いちゃうことをするんだけど、それがでもほんとに大事なとこかっていうのは、こう聞いちゃだめよ、っていう。,それは痛いな、でもな。難しいな。,自己開示,自己開示,嫌悪
そうするとお腹いっぱいじゃないから。いっぱいじゃないから、いっぱいだから、とかいって言われるじゃんねー。,わー、これ違いがわからんのだけど、そんなの。そうやって言われても、あーまちがえたって気がせん。,自己開示,自己開示,嫌悪
っていうか驚かしちゃいかんからー。てかでも、驚かして死ぬのはさー、わかるじゃん、なんか。心臓発作とか人間にも。人間でもありえる。っていうかさあ、趣味悪いねえ、あれ。,悪いなあ、びっくりしたなあ。,自己開示,自己開示,嫌悪
知りたいよねえ。,はーん。もう本人大満足なんだろうね、あれ。,自己開示,あいづち,嫌悪
飛んでないけどー。,でも大丈夫と思うよ、そしたら。,自己開示,自己開示,嫌悪
なんかもう余裕ぶっこいちゃってたもんねえ。,あーびねえ、あびねえ。,自己開示,自己開示,嫌悪
ほんとに私って、ごめんね。なんかねー。,ほら、だってもう、海近えってよ。海だし、こっちー。おーい、おーい。,自己開示,自己開示,嫌悪
うれしいくせにー。,全然うれしくねえ。,自己開示,自己開示,嫌悪
あーんとね、帰りはわかるよ。,もっかい行くか。ちょっと俺知らんわ。,自己開示,自己開示,嫌悪
うん。ごめん。,あー、いいよいいよ。,自己開示,自己開示,嫌悪
うーんと、安いのもあるんだろうし、仕事場の関係もあるんだろうけど。で、でも問題やっぱりあるじゃん、そういう。,外国人の人となー。,自己開示,自己開示,嫌悪
自分たちと違うからっていってルールを守らないのは、なんかそれは違う気がするのね。なんでも、なんでも同じようにしなちゃいけないっていうのは、また違うと思うんだけどー。そういうゴミのルールだとかそういうルールは、やっぱり従うべきかなあと思うね。ニュージーランドもさーあ、ゴミとか分けてないでしょう。,分けてない、分けてない。びっくりした。,自己開示,応答(平叙),嫌悪
いいのそれで？って言ってやりん。名古屋なんかもっと厳しくなるよー。,いや、名古屋は一番今まで甘かったんだよ。,自己開示,自己開示,嫌悪
だ、だ、だ、だ、だ、だ、だめかしら。だだだだ、だめ？だめだめ？,１回おじいちゃんを連れてって、まあそっからあとはもっかい自分のためにどっか考えようかな。住むんだったらニュージーだし、でもそれ行く前に、もっかいいろんなイギリスとかも行きたいし。,自己開示,応答(平叙),嫌悪
忙しいかなと思ったの。でもすごい申し訳なくって、だから。こう、すいません、すいませんって言って私、なんかそんなに休むだったら辞めた方がよかったら、ほんと辞めるんでーとか言ったら、なんでそうなるんだ、とかって言いだしてね。それでもねえ、やっぱ、辞められたか、辞めた、私はまだ辞め、辞めると困る存在みたい。,おお、よかったな。,自己開示,自己開示,嫌悪
ふーん。,中瓶２ケースぐらい持てるんだけど、もうそんとき中瓶１ケースでえらかったもんね。全然もう。あれ、キティちゃん？もしかして。違うかな。あ、違うな。あれみんな翼付けとるね。,自己開示,自己開示,嫌悪
いくつ違いだっけ。,３つ上だもんね、年齢だけでいったら。学年２つ上やろ。細かいことにこだわらんのよね、あの人も。俺と同じで。,自己開示,応答(平叙),嫌悪
うそー。,ほんと。これもまっすぐか。空港線。平田町。,自己開示,応答(平叙),嫌悪
ほんとに、とか言って、疑われそう。,もう疑ってかかっとる、結構。,自己開示,自己開示,嫌悪
あーほんとに。,うん。国際は確実に付くけど。,自己開示,あいづち,嫌悪
なんだろうな。,ワカメとネギ。ワカメとネギってすごい。,自己開示,自己開示,嫌悪
だれかな。,うん。だってさあ、自分がいくら５００円のもの食べたってまちがいなく８００円ぐらい払うからさ。下の方が多かったからね。おいしい。,自己開示,あいづち,嫌悪
つるつるするやろ。,うんうんうん。,あいづち,あいづち,嫌悪
そういう利点があるのかなあ。たぶん、この回りでわかると思うけどね。つうか犯罪せんし、俺。そんな捕まるようなこと。,するんだ。しないの？いったい。,自己開示,自己開示,嫌悪
良心の問題。,いいよ、それで、あの信頼感を買ったと思えば。,自己開示,自己開示,嫌悪
ほんとに。,おう。ファミレスなんか食うもんねえがや。うちの家族見てみ、ファミレスって顔しとらんだろう。,自己開示,あいづち,嫌悪
どっちかがほうじ茶で、どっちか、こっちがねえ、ダージリン、がよければ。,はい、ありがと。,自己開示,自己開示,嫌悪
ふーん。つまみ。,ありがと。店員はもう完全に、これを君が頼んで、俺がハンバーグを頼んだもんだ思とった。もう無理矢理ハンバーグをこっちに置いて、これをここに。俺が、何やかやずらしても、それに割り込むかのようにこれをこっちに置いとる。私はハンバーグっていう感じなんですねーっていう。,自己開示,自己開示,嫌悪
１時とかなんだよね、うちに帰ったら。,俺そんなん、普通に断るな。そういう、もし自分に用があったら。今夜は無理とか。,自己開示,自己開示,嫌悪
あーあー、埼玉大学。,あとＣ短。Ｃ短の妙に落ち着いてー、で、すごい場慣れしててさー、私は嫌いなタイプだけど。,自己開示,自己開示,嫌悪
そんなん知らないよ。来たってあんたから電話来なきゃ意味ないじゃんと思って。,みんなと、みんなお父さんとか待ってたんだよ。,自己開示,自己開示,嫌悪
あんた、だって何時に終わるって確定してくれなきゃ困るわよ。,だから１２時ごろ終わるってゆったよー。ひどいじゃん。,自己開示,自己開示,嫌悪
腹減ってるの？,腹減ったよー。もう変な、変な力使って、もうなんかプルプルプルプルしちゃってさ、私、１人で。足の震え止まんなくなっちゃってさー。,自己開示,応答(平叙),嫌悪
どきどきするよ、私。,でも私、明日１時からバイトなんだよ。,自己開示,自己開示,嫌悪
違うよ、これ。,それは知らん。,自己開示,自己開示,嫌悪
俺には別に言わんでもええ。あんたには、そやけど、エクサイティングな日々だった、ぐらいゆうてきてもええと。,そうかな。そんなん別にお礼状に別にもう１回、別にお礼しか書いてないから、あと。,自己開示,あいづち,嫌悪
日本はもう、もういっちゃんええかげんやねん、子ども、小学校ぐらいでもうなんばうろついたりとかさしてるわけやろ。塾帰りに。,そんなん別になんばうろつきへんでもそこら辺うろついてるやん。要するに諏訪森やったらうろついてるやん、ちっちゃい子が。小学生の。ま、いかん、いかへんぐらいの子ーが。,自己開示,応答(平叙),嫌悪
気にせずしゃべって。,だめや、絶対気にしてる。そうするとちょっと標準語になるかも。なってない。,自己開示,自己開示,嫌悪
あ、そうなん。,うん。,あいづち,あいづち,嫌悪
ほんとにない、ほんとにないよね。なんか、って学部時代の友だちとかに言うとさあ、貯金あるでしょうって言われたけどさ、ないんだってばって。ないからって。,なくはないけども、あんま使いたくないっていう。定期預金とかにやっちゃって、それには手を出したくないぞってね。,自己開示,自己開示,嫌悪
こないだそうや、お姉ちゃんとさあ、お母さんと話しとってさあ、うん、まだF024は振りそで着れるんだよねっていう話になって、未婚やから着れるやん。着れるよ、修了式着てこうかって言ったら、七五三になるからやめろって言われた。失礼な。,いいやん、着たら。,自己開示,自己開示,嫌悪
あー。,Ｆとかしてくれそう。,自己開示,自己開示,嫌悪
それは知らん。,たぶんその人やと思うけど。,自己開示,自己開示,嫌悪
絶対嫌。,なんか入った、すごい３、４年ぶりぐらいだったでしょ。で、なんか入った瞬間歯医者のにおいがしてさあ、もう、すごい帰ろうかなとか、すっごい嫌だと思う。,自己開示,自己開示,嫌悪
だって意識してしゃべっても単におかしくなるもん。日本語じゃなくなるから、だからだんだん。取んね、取んね。,だんだんわからん、最初だから、１０００円とか言う、２０００円。,自己開示,自己開示,嫌悪
きついよー。,ねえ。,あいづち,あいづち,嫌悪
そうそうそうそう、っていうのをさあ、こう気分が乗ってくるときって、やめたくないじゃん。だけど、呼ばれるんだよね、下からね。下行ってさあ、何って言ったらさあ、みんなが忙しくって食卓が空になっとったんよ。だれもおらんくって。お姉ちゃんとお母さんは台所にいるしお父さんとかほかの子たちなんかが、みんなその神だなの掃除とかやっとって、うち猫がおるやん。机の上のものを猫が食べるから、お前そこに座ってテレビ見とれって言うたんだわ。,そしたらキレるなあ。,自己開示,自己開示,嫌悪
そりゃないよ。,つれないか。,自己開示,自己開示,嫌悪
そんじゃあ連絡しようよ。,そうだなー。俺、家の電話番号知らん。,自己開示,あいづち,嫌悪
だめだ。あんたに聞いてもらちがあかない。,んなことわかんないじゃん、俺知ってるかもしれないし。,自己開示,自己開示,嫌悪
例えば、例えばだよ、アフリカに生息するトカゲを診てくれって言われても、困っちゃうでしょ。,でも、まあ、トカゲはトカゲだからさ。トカゲはトカゲ、カモメはカモメだから。それはしょうがない。,自己開示,自己開示,嫌悪
うーん、されるよ。,かわいそう。,自己開示,自己開示,嫌悪
冗談じゃねえ。,よく言うよ、そういうふうに、韓国の人。,自己開示,自己開示,嫌悪
うーん。,ふーん。なんかそれより。,自己開示,あいづち,嫌悪
