発話者2,応答者2,対話行為,対話行為2,感情
いつ？,いつって、古い話じゃん昔だよ。すごくない、あんた、運転が。,質問(YesNo),応答(平叙),驚き
私の運転する車乗るときは踏んでた？,踏んでなかったけどさあ。男だとさあ、何かとばしたがるじゃん。信号がすぐ前赤なのにさあ、そんなつけてもしょうがないって。,質問(YesNo),応答(平叙),驚き
あんたのケーブル私が持っとるんだけど。,もうあげるわ、それ。もう一生やらん自信がある、ゲームボーイ。まあ、でも、あんた持っててもいらんか。,質問(YesNo),自己開示,驚き
板門店っていうの？,ハンモンチャウ。わからんけどね。,質問(YesNo),応答(平叙),驚き
あたしもさあ、あまりにも韓国のこと知らないと思ってさ、前、民族のさ、レポート書かなきゃいけないとか言ってたじゃん。それでさ、ちょっとその韓国でどういう歴史教育がされてるか調べたの。,やっちゃいましたか。,質問(YesNo),質問(YesNo),驚き
うちの弟は、愛知と高知と北海道受けてるんだ。多分、愛知と高知だめで、北海道１次受かってるんだと思う。,２次待ち？,質問(YesNo),質問(YesNo),驚き
左。うん、何に？ああ、飲みにいったの、,ここ？,質問(YesNo),質問(YesNo),驚き
あっ、そうですか。,先生も関西の方ですか。,質問(YesNo),質問(YesNo),驚き
関西出身なんですってね。,関西弁でしゃべった方がいいですか。,質問(YesNo),質問(YesNo),驚き
、実はわたし、今でもＲに家族が住んでて、毎週Ｓから来てるんです。,へえー。通ってらっしゃるんですか。,質問(YesNo),あいづち,驚き
私がフランスにいる時に大学に通われてたんですね、ちょうど。,それは大学院で行かれたんですか。,質問(YesNo),質問(YesNo),驚き
８チャンネルって何だっけ、フジテレビ。,フジテレビって一番芸能好きなんじゃないの？,質問(YesNo),質問(YesNo),驚き
ＮＨＫが、１週間のニュースをまとめてやりますとかってこの間、コマーシャル出てたわよ、ＮＨＫのコマーシャルで。,へー。あ、ラジオ全然かけない？,質問(YesNo),あいづち,驚き
わたしに対応してくれた子すっ飛んでる子だとわたしは思ってたのね。,うん、もう１回生協使ってみれば？あれは大変だけれど、ポーランドに行ったとき、ビザの申請。,質問(YesNo),質問(YesNo),驚き
わたし、この間軽井沢行ったのね。スキーなんてやってたかな。,ふーん、あそこって雪降るの？,質問(YesNo),質問(YesNo),驚き
スコットランドの人たちって、今でもね、羊のお肉が食べられないじゃない。,お肉はだいじょうぶじゃないの？,質問(YesNo),質問(YesNo),驚き
冷蔵庫に入れます。かびちゃうじゃない、こんなのすぐ。これは何だか、くら、このカルってのがね、どうも、隠語的なあれがあるらしくて。これはフランス語のわかる人じゃなきゃ、あげ、あげられないとか何とかって言われたんだけど、わたしわかってないんだけどね。,カルっていうのが、カルチャーのカルじゃないの？,質問(YesNo),質問(YesNo),驚き
お茶入れる所のあみに入ってるんだと思う。,あー、ちゃんとすぐお茶が出るように、葉っぱだってちょっと時間待ってないといけないからじゃないの？,質問(YesNo),質問(YesNo),驚き
出てこない。それほど大きくはないの。ただ、あの、土びんのあれよりもちっちゃいらしい。,ふーん、なるほど、じゃ、これ、あけていい？,質問(YesNo),質問(YesNo),驚き
あそこの真ん中にこういう、あのー、何ていうかしら、花びら型があるじゃない。足のところの空間、あれがちょっとこっち向いてるの。,ふーん、いいんじゃない、少しぐらい。ずれてる方がいいんじゃないの？,質問(YesNo),自己開示,驚き
アメリカって前はさ、なんか言語教育機関あったのよね。どっか、赤坂のあたりに、アメリカ文化センターっていうの。,あ、それは、英語を教えてたの？,質問(YesNo),質問(YesNo),驚き
そのときにどうして国出るのにチェックするのかなと思ってびっくりしたけども。,うーん、反戦運動しないとか？,質問(YesNo),質問(YesNo),驚き
戦争に反対だからって言う子はいっぱいいたわよ。わたしのクラスの学生だってオープンにして違う国に行っちゃったもん、すごい頭いい子が。,うん、でも、アメリカの側からすれば逃げたわけでしょう？,質問(YesNo),質問(YesNo),驚き
まさかさ、日本から来る若いのがそんな転々とすると思わなかったんじゃない？ずいぶん言われたもん、あとで。,だれに？Ｙに？,質問(YesNo),質問(What),驚き
ずーっとバスのってボストンまで行けたのよ。,行けたのか。,質問(YesNo),質問(YesNo),驚き
あ、じゃまされ、あのー、いたずらされたんじゃない？,え、でも真ん中に止まってるわよ、その駐車場の。なんか、まだある？,質問(YesNo),自己開示,驚き
対話形式は質問と答えってよりも２人多くて、司会者もいて、だから多くて３人でしょう。それと、片っぽの高校生の方は、５、６人じゃない。そうするとね。,リーダーいないの、５、６、５、６人で。,質問(YesNo),質問(YesNo),驚き
大学と、自分のうちのなんて、ん、３ＸＸＸはあんまりまちがえないんだけど、一番まちがえんじゃない？　３ＸＸＸだとか、ＸＸだったか。,それどっちの、大学？うちの？,質問(YesNo),質問(YesNo),驚き
最近ね、東京の市外局番って５か３なのよ。,へー、マイライン登録ってした？,質問(YesNo),質問(YesNo),驚き
わたしが外に出てるときさ、上かすごい振動が来ると、わたし、下からわめくんだけどさ。,あ、上の人なの？,質問(YesNo),質問(YesNo),驚き
でも、横よりも、下があれじゃない？うちだってここ、,下？,質問(YesNo),質問(YesNo),驚き
こたつぶとん？違うよ。,下がこたつ敷きとかじゃないの？,質問(YesNo),質問(YesNo),驚き
めがねかけてる人？,かけてなかったっけ、わかんないけど。,質問(YesNo),質問(YesNo),驚き
じゃ、だいじょうぶ、ピンクだよ。,私には紫に見えるの。何？ツタヤ？,質問(YesNo),自己開示,驚き
お兄ちゃんが使ってるやつ、あれどこだっけ、ＮＥＣだった？,パソコン？,質問(YesNo),質問(YesNo),驚き
ノートパソコンの方が高いんだよ、デスクトップより。,そうだっけ。,質問(YesNo),質問(YesNo),驚き
そうだ、聞いてよ。うち昨日は掃除してたじゃん。そろばんが出てきたのよ。いらないからってそろばん捨てちゃったらお母さんが大激怒しちゃってさ。,何かあるんじゃない？思い出が。,質問(YesNo),質問(YesNo),驚き
トヨタ自動車も、外国から来た人たちに教えてるんだけど。うちの海外技術者研修センターで、研修を受けて行った人と、何にも国でも何にもやらないで来た人が一緒に実習するんだって。それで何かＡＯＴＳみたいなところで実習、あの、日本語勉強した人は多少わかるんだけど、初めて来た人は全然わかんないから、その差を埋めるために、また企業が雇ったみたい。うん。,今、え、トヨタ自動車に行ってるんですか。,質問(YesNo),質問(YesNo),驚き
ううん、あたしはそのＡＯＴＳっていう海外技術者研修センター。,そういうトヨタさんみたいなとこでも、そういうふうに雇ったりとかしてますか。,質問(YesNo),質問(YesNo),驚き
え、何？,ここは独り言ですか。あ、つかったーとか。。でも何かあんな中身でよかったんですかね。,質問(YesNo),応答(平叙),驚き
赤ちゃんって出産のとき、頭の骨が重なるじゃん、ちっちゃくなるように。それをしすぎちゃって、長い間。２４時間産道にいたからこれがぐわあって伸びて。,え、そのままんなっちゃうんですか。,質問(YesNo),質問(YesNo),驚き
先生が赤ちゃん引っこ抜くときに、引っこ抜けなくって、もうしょうがないから手を突っ込んでガッて出したんだって。そしたら赤ちゃんのここがき、すり傷になっちゃって。,かわいそう。何か大変ですね、お産の時間が２４時間かかったなんて。ずっとですか。,質問(YesNo),自己開示,驚き
ちょっと納豆発酵させるからーとか言って納豆手作りしだしたらやばいよね。,納豆菌ですか。,質問(YesNo),質問(YesNo),驚き
ユッケは生肉のさ、味づけしてあってさ、卵黄がボトンって置いてあったやつ。知らない？,生肉を食べるんですか。え？焼かずに。,質問(YesNo),質問(YesNo),驚き
でもなってるとしたら、もうなってるって言ってたよ。,あ、そうなんですか。,質問(YesNo),質問(YesNo),驚き
今安いじゃんね。牛肉売れなくて。じゃあ食べた方が得だよとかって言ってた。,今牛肉食べるのやめたから人体に影響はないって感じでもないですよね、ほんと。,質問(YesNo),質問(YesNo),驚き
みたいだって。,死んじゃうんですか、ほんとにあれは。,質問(YesNo),質問(YesNo),驚き
何これ、え。,え、００番もいるの？,質問(YesNo),質問(YesNo),驚き
とら、それか仮って書いてあるのがあってたんでそのまま取ってたか。,いますか。,質問(YesNo),質問(YesNo),驚き
ヤマダ電機知らない？どこら辺の会社なのか知らないけどー、とりあえず名古屋では、まあまあ、知られてる。,えっ、チェーン店なの。,質問(YesNo),質問(YesNo),驚き
先生、午前中は体調不良だったけど、午後からは出ますとか言ってたけど。,風邪？,質問(YesNo),質問(YesNo),驚き
え、で、だってさあ、,飛行機代が？,質問(YesNo),質問(YesNo),驚き
グアムは、アメリカって感じではない。,ふーん。なんか南の島って感じ？,質問(YesNo),あいづち,驚き
昨日行ったご飯屋さんはね、へんなレンタル屋さんの隣のお店。,Ｂ屋の近く？Ｂ屋？,質問(YesNo),質問(YesNo),驚き
うちのいとこさー、ハイオクなんだよね。あなたが乗ってる同じ車種で。,ハイオクの方がいいのかな。,質問(YesNo),質問(YesNo),驚き
そう？,情けなすぎる。こっちあるかもしんない、探してみよー。つーかさ、途切れるといかんのじゃない？これって。,質問(YesNo),応答(平叙),驚き
トランプの非ソリティアって、非。,ひ？ひ？,質問(YesNo),質問(YesNo),驚き
かな。,これ？,質問(YesNo),質問(YesNo),驚き
名古屋ってSEみたいな仕事ないじゃん。,そーお？東京の方がやっぱりあるってこと？,質問(YesNo),質問(YesNo),驚き
大阪なんか企業が大きそうじゃない？,ふーん、そうなの？,質問(YesNo),質問(YesNo),驚き
うちの会社でもー、やっぱり名古屋は、なんか、,ないって？,質問(YesNo),質問(YesNo),驚き
なんで。,なんじゃそりゃって思うんだけどー。だってさー、そんなのさー、商売じゃないーい？,質問(YesNo),自己開示,驚き
でも今なにしてんの？,今？,質問(YesNo),質問(YesNo),驚き
教授って最初どっから始めるの？,最初の肩書きのないポストから始まるんじゃないの？,質問(YesNo),質問(YesNo),驚き
Ｂちゃんの家ってどこなの？,んー？日比野って知ってる？,質問(YesNo),あいづち,驚き
知らなーい。,知らない？,質問(YesNo),質問(YesNo),驚き
あーでもそういう感じだよねー。,ううーん。向こうはそういう感じだった？,質問(YesNo),あいづち,驚き
あーあれじゃないの。ビジョナリアムでしょう。,っていうんだ？,質問(YesNo),質問(YesNo),驚き
ミクロアドベンチャー映画があるじゃない、３Ｄで。,犬が出てくるやつ？,質問(YesNo),質問(YesNo),驚き
あれはだれがやってるの？有名な人？,画面の説明ってどんなこと言われたっけ。,質問(YesNo),質問(YesNo),驚き
アトラクション始まる前に、皆さん安全のためにこの安全コードをしてくださいって話す人って、全然知らない人？,うーん、あったかもしれない。え、それ流れるのって、別室だった？,質問(YesNo),応答(平叙),驚き
２階のとこでー？,２階かどうか、えー、１階じゃなかったー？,質問(YesNo),質問(YesNo),驚き
記憶になーい、何とか探偵って言ってたじゃん。,え、ちびっこ探偵って言ってた？,質問(YesNo),質問(YesNo),驚き
私、日本語を教えるバイトしてるんだ。,だれにー。外国人？,質問(YesNo),質問(What),驚き
私のバイト先浜松にもあるんだけど、浜松には日本語検定用のことを教えられるような大学院生とかー、そんな人がいないんだって。,えっ、あなたはその試験受かったんだっけ。,質問(YesNo),あいづち,驚き
キルフェボンってお店、浜松にあるみたいだよ。,あれっ、浜松の方ではー、いっぱいチェーン店なってるの？,質問(YesNo),質問(YesNo),驚き
キルフェボンってお店は浜松に一個しかないと思う。,１個だけ？,質問(YesNo),質問(YesNo),驚き
アクト、アクト・シティだったっけ。あの浜松の駅のこっちにキルフェボンがあると思う。,そん中に入ってる？,質問(YesNo),質問(YesNo),驚き
１人で行った。,あっ、１人で行ったんだ。,質問(YesNo),質問(YesNo),驚き
私たちが行った、フランスの教会は古そうな教会じゃなかったよ。,そうだっけ。,質問(YesNo),質問(YesNo),驚き
ペナン島で会った人覚えてる？,そ、そ、そ、そ。なんか、モハメドアリなんとかかんとかの展開じゃなかった？,質問(YesNo),応答(YesNo),驚き
旅の最後で買ったお弁当、覚えてない？,なんか葉っぱになんかあったやつ？,質問(YesNo),質問(YesNo),驚き
モンサン・ミッシェルね。ミッチェル。,人の名前だ。ふーん。あれ見てみたいな。見た？,質問(YesNo),自己開示,驚き
自然が残されてるところもさ、世界遺産に登録されてるよね。人が作ったっていうことじゃなくてさ自然だけのところ。,グランドキャニオンとかそういうとこ？,質問(YesNo),質問(YesNo),驚き
グランドキャニオンとかあと、なんだっけ、北海道の方のさ、沼地も世界遺産に登録されてるよね。,あっ、そうなの？そうなの。入ってるの？,質問(YesNo),質問(YesNo),驚き
学部の。,卒業旅行？,質問(YesNo),質問(YesNo),驚き
うん、なんていうんだっけ、あれ。,ケーブルカー？,質問(YesNo),質問(YesNo),驚き
ケーブルカー。ケーブルカーとちょっと違うんだなー。,ロープウェイでもなくて。,質問(YesNo),質問(YesNo),驚き
タイ行ったとき３日連続で同じもの食べたじゃーん。,それでけんかになったんだっけー。,質問(YesNo),質問(YesNo),驚き
別れる人多いんだ。,そうだねー。,質問(YesNo),自己開示,驚き
祝日の東名高速はめっちゃ警察多いよ。,そうかな。,質問(YesNo),自己開示,驚き
学校まで車で行ってるの？,ううん。違う違う。,質問(YesNo),応答(YesNo),驚き
バイクで来ても事故らんでしょ、だいじょうぶでしょ。静岡まで来たことあるでしょ。いきなりねーバイクで車で来るわけじゃないし。,バイクってやっぱ危ない？,質問(YesNo),質問(YesNo),驚き
島田の子なんだけど、とびやっててさ、大工系。,それで何、派遣みたいな。,質問(YesNo),質問(YesNo),驚き
何かそんなこと言ってた。友達が立て続けに亡くなったの。で、元彼も死んでる子なんだよ、その子。縁起でもないことがあるんだよね。,やっぱ、あるんだね。Ｈちゃん１人で、もうちゃんとやってんの？,質問(YesNo),自己開示,驚き
学会で乗っていこうって車がね、普通のお父さんが乗るみたいな車で。,うんうん、セダン？,質問(YesNo),質問(YesNo),驚き
え？,今は静かなんですか。,質問(YesNo),質問(YesNo),驚き
そうよ。だからね、Ｂさんとね、あなたあんまり高いとかって、編んだら、損しちゃうね。それが今ごろわかったの。,でも、お材料も今お高いでしょう？,質問(YesNo),質問(YesNo),驚き
きょ、恐怖にとらわれてね。そ、夏、あの、春ごろそうだったもん。だってね、私のいとこが一回り上でね、津田を出てね、あのロンドンやなんか長く生活、三菱商事で、長くいた人がね、ハイウェイパトロールね、さん、おもしろいわね、いう人なのよ。一回り上なの。まだ亡くなったって話聞かないから。百いくつじゃないの、あー恐ろしや恐ろしや。,お元気なの？,質問(YesNo),質問(YesNo),驚き
補聴器って高いのよーってね。,うん十万円ですって？,質問(YesNo),質問(YesNo),驚き
ジュベルニはねモネの生家があるとこなんです。,ああ、あの橋があるところ？,質問(YesNo),質問(YesNo),驚き
私ね、アレルギー体質だけど、犬飼ってるけど、犬のアレルギーはないの。それからね、杉もないの。ダニとほこり。,ほこり？,質問(YesNo),質問(YesNo),驚き
私の父が死んだときね、ええと８６歳、,ええ、でも大丈夫でした？,質問(YesNo),質問(YesNo),驚き
うーん。男の人にも更年期あるっていうからさあ。,うーん。,質問(YesNo),フィラー,驚き
槇原、痛風だったんだって。,それで引退？,質問(YesNo),質問(YesNo),驚き
わたし、歳はＳさんと同じぐらいかなあ。６５か６か。,あ、そうですか。,質問(YesNo),あいづち,驚き
和光大学。わ、和光っていうのは、あの、埼玉かと思ったら違った。埼玉県に和光市っていうとこがあるから、あそこかと思ったら違うんですよね。町田市、和光大学。,和光大学ってありますよね。町田にあるんですか。,質問(YesNo),確認,驚き
あの人が一番、Ｌ大では第１号の博士論文を書く人。,あの、あれ、彼女は？Ｂ２さんは？,質問(YesNo),質問(YesNo),驚き
新しい学部を作ろうとすると文部省が、留学生はどうしますかって。もともと入れるつもりなく作ったのに、３０人留学生を入れることになって。そしたらてんやわんやで。,今うまくいってるんですか。まだ大変ですか。,質問(YesNo),質問(YesNo),驚き
学部創設して今でも大変です。あの、人間関係がね。,ああ、そうですか。,質問(YesNo),あいづち,驚き
Ｋ３先生なんかも１期生とかそういうあれですか。,いや、Ｋ３先生は。どちらの先生？Ｌ３子先生？,質問(YesNo),応答(平叙),驚き
ですかね。,後任は見つかりそうですか、Ｒ２先生の。難しい？,質問(YesNo),質問(YesNo),驚き
ええ。,２０００人近いでしょう？,質問(YesNo),質問(YesNo),驚き
アメリカの大学だと、なにか１つポストがあるっていうときには、絶対日本人はもう一番最後になっちゃう。もうアメリカ人がいればアメリカ人だし。,うん。日本に帰ってこないの？帰ってくんでしょう。来ないの？向こうにいるつもりなの？,質問(YesNo),あいづち,驚き
息子がなんで中国がそんなに好きなのかっていうのは我々の夫婦の影響よ。,あなたの息子はもう中国に行ったわけ？例のフィールドワークで。中国には行ったことあるわけ。まだないの？,質問(YesNo),質問(YesNo),驚き
息子は、今度は中国に１月とか、それから中国語を勉強するためにってんでアメリカに行った２年後だったかに夏は７週間ぐらい行きましたね。,どこに行ったの？北京？,質問(YesNo),質問(What),驚き
語学留学の時はどこに留学行ったんだっけな。,田舎？,質問(YesNo),質問(YesNo),驚き
わたしなんかもうアメリカ行ったときに、外交官もいたんだけど、その外交官、真っ赤なワゴンに乗ってる。あれが外交官かね。日本の将来任せられないよって主人と言ってたの。,キャリア組？,質問(YesNo),質問(YesNo),驚き
イルミネーション瞬く夜空クリスマスって俳句は札幌行ったときに書いた俳句？違うかしら。札幌のイルミネーションがすごいきれいなんだけど。,札幌？,質問(YesNo),質問(YesNo),驚き
えっ、このテレビに出てる人の国籍は？,うーん、国籍はねー、ラトビア共和国生まれ。てなってるけど。ユダヤ人なんじゃない？,質問(YesNo),応答(平叙),驚き
ねえ、あのさ、ＡＮＡだったよね。１万円のさ、チケット売り出してたんでしょう、２５日に。あれどういうシステム？,２５日。なんか誕生日じゃなくて？,質問(YesNo),自己開示,驚き
ANAが飛行機のチケットのセールで、どこまで行っても１万円とか言っててー。それは片道１万っていうことかな？,そうじゃない？,質問(YesNo),質問(YesNo),驚き
うん？全部って？,映画によって別に違うわけではないんだ。,質問(YesNo),質問(YesNo),驚き
例えばさ、最近でも、あっ、ごめん、あたっちゃった。最近でもないんだけど、ほら、常盤貴子が出ててー、で、あとさ。,かば、かばちたれー？,質問(YesNo),質問(YesNo),驚き
幼なじみとして。同じデパートで働いてた。,デパートだったっけ。,質問(YesNo),質問(YesNo),驚き
ねえ、フレンズってさー、おもしろいと思わなかった？,フレンズ？,質問(YesNo),質問(YesNo),驚き
あれ、アメリカの、あれ？あれ、アメリカかな？アメリカじゃなかったかな。,イギリス？,質問(YesNo),質問(YesNo),驚き
フレンズって番組は、独身男女５人ぐらい。５〜６人出てくるやつでー、もろコメディで、なんか共同生活してるの、ある、アパートの一室を借りて。,一室で？,質問(YesNo),質問(YesNo),驚き
フランスで放映されてたアメリカのドラマなんだけど、女の子がやっぱり主人公で、その子は、ドラキュラなの。,ドラキュラ？,質問(YesNo),質問(YesNo),驚き
あっ、ぶーふぃーってやつ、今でもスカパーでやってんの。ふーん。,なんかー、あのドラキュラの話でしょう？,質問(YesNo),質問(YesNo),驚き
主人公の女の子ってちっちゃくて細い子がアメリカとかでもうけるんだと思ったら、なんかびっくりして。,前は違ったんだっけー？,質問(YesNo),質問(YesNo),驚き
チャーリーエンジェル？わかんない。,あっ、ちょっと古すぎた？,質問(YesNo),質問(YesNo),驚き
あっ、本当？,あんまり？,質問(YesNo),質問(YesNo),驚き
なんか固まっとる、砂糖やね。ガリガリっていったよ。これ何だろ。,甘い？,質問(YesNo),質問(YesNo),驚き
絵の具固まってしまってるの、溶けんかった？,うん。だって絵の具って、もう、固まったら、もうどうしようもないでしょう？,質問(YesNo),応答(YesNo),驚き
狂牛病は日本で出たから、きっとそのうち韓国でも、そんなんいっぱい出るんじゃないっちゅう話だよ。うん。,だけど、一番それ、いろいろ牛、牛なんかもいるやろう、そこのオーストラリアは。ところが、出てないっていう、こないだ、なぜって書いてあったでしょう？,質問(YesNo),自己開示,驚き
私、大学１年のころの体重と今の体重とね、ゆうに１０キロ違うよ。ほんとに。,大学時代に太ったってこと？,質問(YesNo),質問(YesNo),驚き
いや、中学のとき。,中学校のとき？,質問(YesNo),質問(YesNo),驚き
そう、Ｔちゃんがでかい腹して来た、ときじゃない？,それが一昨年かね？,質問(YesNo),質問(YesNo),驚き
