発話者2,応答者2,対話行為,対話行為2,感情
だからー、ここの、その、Ｋの、その募集の売り文句じゃないけどー、として、その修論書かなくても卒業できますっていうのが。,え、そんなん売り文句になってんの？,質問(YesNo),質問(YesNo),期待
どうしよう。月々５０００円だよ。まともに行けば。,それプラス携帯の電話料金が入るの？そういうこと？,質問(YesNo),質問(YesNo),期待
うん。電話回線は来る来る。,うん。だったらー、その電話、電話回線を使って、電話ーができるわけでー、そしたらー、もしかして携帯使うよりも料金安くない？,質問(YesNo),あいづち,期待
そうだね、そうだよねー。１万５０００円のに、行ってみようかなー、それとも。,Ａさんの話を聞いてからにする？,質問(YesNo),質問(YesNo),期待
みそ汁に入れたりとか。,みそ汁にキャベツいれるん？,質問(YesNo),質問(YesNo),期待
や、食べに行くもんなん？小倉トーストって。,違うの？,質問(YesNo),質問(YesNo),期待
ブラック飲むならエンブレム。,ルーツの？,質問(YesNo),質問(YesNo),期待
さ、書きましょう。,はい。この、えーっと、収集者がＡさんでいいの？,質問(YesNo),あいづち,期待
はい、この、ダ、ゴダードも、お返しするわ、じゃあ。,どうも。じゃ、勉強でもしてみる？,質問(YesNo),自己開示,期待
でも、たぶん何百円のあれやっでさー、また、聞けばいいけど。うーん、なんかないかな、いいところ。,ね、卒業旅行は長崎？,質問(YesNo),質問(YesNo),期待
私、バリ島行きたい。いいな、ベトナムいいねえ。,ベトナム？,質問(YesNo),質問(YesNo),期待
ううん、あー、F143ちゃんにあげて。あっあった、も、もう１枚Ａちゃんにあげようと思って。,あー。なんか、ね、携帯のその、２１、Ｆ２１１０？,質問(YesNo),フィラー,期待
あんかけチャーハンにしようかなあとかいうのから。,でも私ーとかいいながら録ったの？,質問(YesNo),質問(YesNo),期待
でもさあ。どっちがいいかなあ。,ねえ。なんか、仕事しにくくはない？逆に。,質問(YesNo),あいづち,期待
なら出ちゃおうかなあ。,聞いてみたら？,質問(YesNo),質問(YesNo),期待
通知が来るのは５月ごろかな、でも、何しようという。こんなこと言っちゃいけないんだけど、ないしょですけど、ま、具体的に何をするかというので、で、最初の年だけちょっと予算が大目に来るわけ。で、,３年計画でしょ？,質問(YesNo),質問(YesNo),期待
最初に行ったところの、あの、市場で、お魚とかいろんなものをこうね、並べてて、トマトがあったから買ってみようかなー。,かびは、はえてるように見えませんでした？粉、粉ふいてません？,質問(YesNo),質問(YesNo),期待
せ、召し上がりますか。,いやいやいや。あ、あれしましょうかね、先生、少し。め、召し上がります？,質問(YesNo),応答(平叙),期待
ふーん。２人で詰めていくの？話を詰めていくの？,ああ、あと、Ｆさんとの発表？,質問(YesNo),質問(YesNo),期待
もうすぐだね、でも。へー。,うん。うん。いいんじゃない？,質問(YesNo),フィラー,期待
空いてるやつ下げてよろしいですか。,ごちそうさまでしたー。はいたことがある？,質問(YesNo),自己開示,期待
まあ、お茶、残ってんねんから、お茶飲んだらよろしいがな。,そうですね。あ、お茶、いります？もらいます？,質問(YesNo),あいづち,期待
ついでにお茶もらおうか。,ん。ついでがありそう？,質問(YesNo),あいづち,期待
友人でいいんやろ？,共同研究者。研究まだしてないか。で、友人って？,質問(YesNo),応答(平叙),期待
相談。彼女が大阪来るから。,会いに？,質問(YesNo),質問(YesNo),期待
鴨もおいしそうだけど、最近、牛肉食べてないから牛肉にする。,うんうん、いいの？,質問(YesNo),質問(YesNo),期待
待機状、うん、ってかまあ、行けば、なんか泊まったのは市内の中心で、まあ便がいいとこでさあ、で、お客さんってやっぱ、そういう食品業界でコスト重視するから、田舎になるわけよ、工場が。だから行くなら１日１軒とかになっちゃって。で、帰ってきてさ、で、だれかおれば、ま、旅行とかでもそうじゃん。だれかおればさ、飯とか気をつけることない？ちょっと気使って。１人だと結構、まあいいやってなる。そのまあいいやがずーっと２週間ぐらい続いたからさ、それでいきなりやせて。,うん。何日？２週間あったの？それ。,質問(YesNo),あいづち,期待
これでふいていい？,それ手ふきじゃない？,質問(YesNo),質問(YesNo),期待
探してはいるの？,あったらやるんじゃない？,質問(YesNo),質問(YesNo),期待
そこもつければいいじゃん。そのカーテン。,ここ？,質問(YesNo),質問(YesNo),期待
いや行けるて。たぶん３００万ぐらいで行けると思う。,そんな安いの？,質問(YesNo),質問(YesNo),期待
聞く？,うん。聞かん？,質問(YesNo),応答(YesNo),期待
で、そのあとに興行収入とか考えて。で、よかったら２って。,「ゴジラ」とかは続かんかった。知っとる、あれ、「ゴジラ」見た？,質問(YesNo),自己開示,期待
じゃなんか歌を歌おうかな。,あ、でも、もうすごいちょっとだよ。じゃないの、これ。,質問(YesNo),自己開示,期待
それにしか使えない。でも調味料とか増えるよねー。,増えるねー。どんどん増えてます。＜間＞彼、やるの？料理。,質問(YesNo),あいづち,期待
彼がやる。いや、F026んとこと一緒だって。条件が同じだったら、モチベーションが高いっていうか、食べたい方が作る方がいいかな。,うん。じゃF162は何やってんの。掃除とか洗濯？,質問(YesNo),あいづち,期待
あー、あたしも行きたい。島、好きだから島行きたい。もう１回沖縄でもいい。,地中海とか行きたくない？,質問(YesNo),質問(YesNo),期待
あ、すっごいやりたい。あー。,行かない？,質問(YesNo),質問(YesNo),期待
アウトドアサークルじゃん。いや、そうじゃなくてー、ＦとＧとー、遊びたい遊びたいっていう話をしててー。,あ、あたしＦの車？,質問(YesNo),質問(YesNo),期待
いや、なんかさー、なんかたぶんだめだと思うんだけどー、その希望職種ん中に、その他っていうのがあってー一応書けるのね。で希望職種ん中には広報はないのよ。だから、ちょっとＪで広報っていうのをやってみようと。,広報に興味があるの？ある？,質問(YesNo),質問(YesNo),期待
冬ってスカートはきたくなる。,うーん、そう？,質問(YesNo),質問(YesNo),期待
出来上がりつつあるんだ。,やってるよ。動機付けやんないの？,質問(YesNo),応答(平叙),期待
データなしで書こう。なしで書いてー、へれす間に合う？,間に合わせる？,質問(YesNo),質問(YesNo),期待
こんなトークでいいのかどうかわかんないけどさ。Ｈ中高等学校のさ。,あの、たぶん知ってるでしょ？,質問(YesNo),質問(YesNo),期待
パッチ張って直すんだ、そこを。,つぎはぎみたいなもの？,質問(YesNo),質問(YesNo),期待
あそこ西アジアなの？,違うの？,質問(YesNo),質問(YesNo),期待
だからー、荻窪に、建てて、でしょ。荻窪。,でも荻窪にいたの知ってる？,質問(YesNo),質問(YesNo),期待
そこの道、あー、そこ左。,知らねえよ、そんなの。おせえよ。え、これまっすぐ行くと何かあるの？何か突き当たったっけ。,質問(YesNo),応答(平叙),信頼
あなたは安全運転よね。あたしね、さすがに人を乗せたら安全運転だよ。,うん、俺も１人のときは、がーって行くけどさあ。人乗せたら、人の命預かっちゃったら、いかんじゃんね、そんなの。,質問(YesNo),自己開示,信頼
お願いしまーす。,はー。分かりました。,質問(YesNo),あいづち,信頼
うん。,それちなみにおいしかった？,質問(YesNo),質問(YesNo),信頼
だから直前にＣ手っところで教えてて、こっちに変わってきたら、やっぱりまじめだなって感じます。,全然違いますか。,質問(YesNo),質問(YesNo),信頼
基本的にね教えるのは女の子の方がやりやすいですよね。,ねえ、単位補充が一番やりにくいです。,質問(YesNo),自己開示,信頼
トークショーが始まる前に今日のおめざですなんてさ運んでくるのがあるわけ。それはゲストが指定するお菓子とか、何かちょっとした食べ物なんだけどさ。,あーそっちに興味があるんじゃないの？,質問(YesNo),質問(YesNo),信頼
そいでね、特に今年の夏はね太ったなって特に感じるの。,うん、太ったの？,質問(YesNo),質問(YesNo),信頼
う、うん。,え、日本人が行くの？アメリカ人が行く。,質問(YesNo),質問(YesNo),信頼
ジェット、ま、何でもいいや。それね、ん、ｚｅｐｈｙｒtがいいよって言ってくれたからさ、それ、何か行って、旅行社行って、聞いて、そいで何とかです、ね、でいいですねって言うから、あ、あのころ、その、わたしがイギリス、ア、アメリカ行って一番困ったのはノーって、ノーって言わなきゃなんないことがいっぱいあるんだけど、日本でノーっていうことはほとんどないからさ、あなた難しくなかった？わたしアメリカで一番難しかったのがね、ノーってことだった。,でもそんな、会社に行ってるわけでしょう？飛行機の切符、飛行機。,質問(YesNo),確認,信頼
うん。,岡崎のあの、Ｇの人ですか。,質問(YesNo),質問(YesNo),信頼
ばかりも。ばかりもって使う、か。,ないですかね。,質問(YesNo),質問(YesNo),信頼
私はラオです。あ、ラオじゃないんだ。みんなの日本語だから。,名前も全部決まってるんですか。,質問(YesNo),質問(YesNo),信頼
火曜日５〜６限。火曜日５〜６限。比較文化論。比較文化論。ここの数字が違って。こっちの方が新しく出ていて。,じゃあ英文と日文ですか。,質問(YesNo),質問(YesNo),信頼
はい。,日本文学科でしょ。で、英文科で。,質問(YesNo),質問(YesNo),信頼
９９９。,これ３年だね、そうしたらね。９８はいない？,質問(YesNo),自己開示,信頼
へーえ。うん、あるよ。あるよ。,あるー。,質問(YesNo),質問(YesNo),信頼
うん。,で、子どもはー、半額なの？,質問(YesNo),質問(YesNo),信頼
グアムは南の島ってかんじかな。,英語通じる？,質問(YesNo),質問(YesNo),信頼
どうすんの、あなた、Ｐと。,妊娠？,質問(YesNo),質問(YesNo),信頼
うん。,へー、ピンク色？,質問(YesNo),質問(YesNo),信頼
ほら、これここ、ここスタート、スタート。で、最近黒が、黒、パンダがさ、あ、パンダが先。あとは普通のオセロだ。,何これ。単に、パ、対パンダ戦？,質問(YesNo),質問(What),信頼
パンダママ、子ども。,これ？えー、色変わりをやりゃーいいのかな。,質問(YesNo),質問(YesNo),信頼
うん。,ふーん。え、それはどういうことなの？あの、本社が集まってる所の方がやっぱり仕事が多いってこと？,質問(YesNo),あいづち,信頼
以上になりますって。,なんでー？ほかでは言わないの？,質問(YesNo),質問(What),信頼
うん。,ほら、わかる？,質問(YesNo),質問(YesNo),信頼
うん。,あ、そうそう、さっき言ったそのー、ＳＥまがいの友達ね、その子結婚してんだけどー、その子のうちもさー、前のー、結婚前のーだんなさんの住んでた部屋、そっくりなんだって。そういうのってのはよくあることなのか？,質問(YesNo),自己開示,信頼
私の彼、家事は言えばやってくれるって感じかな。,言わなきゃやんない？,質問(YesNo),質問(YesNo),信頼
ううん。,まだ行ってないの？,質問(YesNo),質問(YesNo),信頼
うん、うん。,これ言ったっけ？,質問(YesNo),質問(YesNo),信頼
あー、それあるある。今もある。,あるの？,質問(YesNo),質問(YesNo),信頼
服部真湖。,真湖さん？,質問(YesNo),質問(YesNo),信頼
も、なんかユンケルのよう。,違ーう、違う。口蹄疫の字はー、口にーひづめ？,質問(YesNo),自己開示,信頼
私も、就職したらコンビニ飯ばっかりになるかもしれない。だってわたしフランスにいたとき、結構その傾向あったもん。,残業すごかった？,質問(YesNo),質問(YesNo),信頼
ボンだとー、フランス語でグッドっていう意味なんだって。でー、本当に天気がいいときはー、なんかボンの方を言うね。,ふーん。えっ、じゃあ、キルフェボンってめっちゃ天気がいいっていう意味なの？,質問(YesNo),あいづち,信頼
うん。そ、そ、そ、そ。,あの人元気にしてるかな。,質問(YesNo),質問(YesNo),信頼
うーんん、うんうんうん。,なんか遊歩道じゃないけど、そういうのがいくつか続いているんじゃない？,質問(YesNo),質問(YesNo),信頼
あ、もうオッケーだ。全然オッケーです。,全然オッケーですか。,質問(YesNo),質問(YesNo),信頼
うん。,下で行くと５時間ぐらい？,質問(YesNo),質問(YesNo),信頼
私が欲しい本は編み物の本なの。あのね、先生がね、ちょっとご病気なの。,毛糸は買ってらしたの？,質問(YesNo),質問(YesNo),信頼
してくれますよ。,遠くなっちゃったけどちゃんと来てくれますか。,質問(YesNo),質問(YesNo),信頼
ええ、来てますよ。,ふーん、あ、そうですか。あんまりこのごろそういうの取らなくなっちゃったから、もうどこに頼んだらいいのかしらねえって言って。下はだめでしょう？下、な、どうしてます？あのー、あの、Ｕ？,質問(YesNo),あいづち,信頼
そう。その方が効くの。だからね、それまた買ってこなきゃなーなんて思って。,Ａちゃんといつも行ってらしたあそこの病院は？もう行かなくていいの？,質問(YesNo),質問(YesNo),信頼
だからめがねがね、あの、私ね、先にね、枕元に置いてふ、あの、ふん、踏んづけてね、めがね。,割ったの？,質問(YesNo),質問(YesNo),信頼
だからね、そういうときのめがねと、そこで使うめがねと別にしてあるのね。それで、あの、読むでしょ。,うん。でも普段こうやってめがねなしでらっしゃるのでしょ？,質問(YesNo),あいづち,信頼
だいじょうぶ、だいじょうぶ。,だいじょうぶ？,質問(YesNo),質問(YesNo),信頼
デジカメは主人が使ってますけど。,プリンタ持ってらっしゃるんですか。,質問(YesNo),自己開示,信頼
私が死んじゃったとき、順天堂アイバンクに登録してるから目以外は、解剖する必要があったらしてください。ってのもちゃんと書いておいた。,でも、これだけ年取ってきて私なんかもう白内障がひどくてめがねを掛けないと何も見えてないけどそれでも大丈夫なの？,質問(YesNo),質問(YesNo),信頼
三社祭のとき辰之助さん、ちょっとおけいこに来てたって言って。,うんうんうん。もうそれこそ私たち１０年ぐらい前になっちゃうの？,質問(YesNo),あいづち,信頼
いいえ、わたくしの方です、確か。,日本語教育学の方ですか。,質問(YesNo),質問(YesNo),信頼
だけど、Ｏ先生なんか、まだ、ばりばりとなさるでしょう。,６５ぐらいの方ですか。,質問(YesNo),質問(YesNo),信頼
コーヒーの方を。,コーヒーをお持ちしますか。,質問(YesNo),質問(YesNo),信頼
彼は今ばりばりいろいろ、英語のコーパス研究やってるんだけれど。非常にせっかちで、仕事が速い人なのよ。,コンピュータ強い。,質問(YesNo),質問(YesNo),信頼
うん。,一時、ものすごくはやったんだけど。それは舞妓さん。これかわいいでしょ。。かさとかないし。あんたが教えた生徒かなんか？,質問(YesNo),自己開示,信頼
うん。,なら、あんたより若いわけ？,質問(YesNo),質問(YesNo),信頼
そうそうそう、うん。,べ、別々のとこいるんでしょ。,質問(YesNo),質問(YesNo),信頼
これ使えるでしょ、これ。,うん。,質問(YesNo),あいづち,信頼
こっちの方が自然なような。,ふーん、そうねえ。,質問(YesNo),あいづち,信頼
うん。,この小さいのいいの？,質問(YesNo),質問(YesNo),信頼
頑丈そう。,これ紙もほら、まだ、しわに、の紙じゃない、ほら。ただあれだからね。これは送ったって壊れないよ。何でもないけど。興味持ってる人ね、こんなの？,質問(YesNo),自己開示,信頼
この阿波踊りのさ、これと、子どもも踊ってるの、これ一緒。どうでしょう。,それ、それがいいの？　うん。,質問(YesNo),質問(YesNo),信頼
うん。これとこれにする。,それと？,質問(YesNo),質問(YesNo),信頼
うん。,うん、これこっち。これは？,質問(YesNo),自己開示,信頼
この。藤娘から取ったのね。,とったか。,質問(YesNo),質問(YesNo),信頼
はい、始まりました。声出してよ。じゃ、ちょっと遠ざけとくね、マイク。ちょっと待って。それはなしだって。いいよ、声変えてしゃべってくれてもいいから。,いい映画あった？,質問(YesNo),質問(YesNo),信頼
はーあ、でー。,わかっ、わかる？,質問(YesNo),質問(YesNo),信頼
幼稚園の時のことだから、私が覚えてるだけでその子なんか絶対忘れちゃってるんだろうけど。その子の顔を見れば、そのことしか思い浮かばないよね。,でもさ、今その子に会ったら言える？,質問(YesNo),質問(YesNo),信頼
うん。,日本の？,質問(YesNo),質問(YesNo),信頼
うん、ベルギーの。これね、あの、Ｑ君のやつもこんなようなやつやったね。,うん。こういうのあるんやね。この写真で。写真屋さんでやっとんの、これ？,質問(YesNo),あいづち,信頼
そうでしょう。そうよね。,やめたんかね？,質問(YesNo),質問(YesNo),信頼
ちょっとお母さん、食べかけ食べたやろ、今、私の。ちょっと。私の食べかけ、ここにあったの。,そうやった？,質問(YesNo),質問(YesNo),信頼
私が。,あ、え、まず値段だけで探したの？,質問(YesNo),質問(YesNo),信頼
なんか話題をください。,論文進んでる？,質問(YesNo),質問(YesNo),信頼
棚、使ってますよ。使ってます、使ってます。,組み立てられた？,質問(YesNo),質問(YesNo),信頼
いやいやいや、だいじょぶ。,１０分録りました？,質問(YesNo),質問(YesNo),信頼
うちはもう、私が帰ってくると信じてますから。,あー、はー、そうなの。そうか、そうか。えっ、帰るの？,質問(YesNo),自己開示,信頼
うん。,何、ソウル？,質問(YesNo),質問(YesNo),信頼
うん。,今行ってないの？じゃ。,質問(YesNo),質問(YesNo),信頼
そうそうそう、それもあってさー。テニスなんかやってる場合じゃないでしょうとかって、うーるさいんだー。それ、おっしゃるとおりです。ね。一発触発って感じ。どっちが切れるかって感じだよ。,うそー、それはお母さん？,質問(YesNo),質問(YesNo),信頼
うん。,ま、でも、ついてる先生は違うからいいのか。＜間＞みんな新しい人なの？,質問(YesNo),自己開示,信頼
うん。,１人？,質問(YesNo),質問(YesNo),信頼
うん。,１人、１人を１人で面倒見たってこと？,質問(YesNo),質問(YesNo),信頼
うん。,へー。えー、でも、そんなことで、ベビーシッターで１日過ごしてたらさ、自分の働いた給料がみんな、その、保育の方に行ってしまうぐらい？,質問(YesNo),あいづち,信頼
うん、ますよー。,そうか。お正月、お姉さん帰ってみえる？,質問(YesNo),あいづち,信頼
あーそうすか。はくげいも。,あのー、ダイエーを過ぎてー行くんだったよね、たしか。あれ、ダイエー、ダイエー、あれって？,質問(YesNo),確認,信頼
ほのぼの系で。,え、大きい映画館でやってる？,質問(YesNo),質問(YesNo),信頼
ボーナー。,ボーナーは麻婆なす？,質問(YesNo),質問(YesNo),信頼
まだ俺の友達、２２だよ。,２３じゃないの。まだ２２？,質問(YesNo),質問(YesNo),信頼
しゃいたま。,しゃいたま？,質問(YesNo),質問(YesNo),信頼
元気だよ。,そう、電話してる？,質問(YesNo),質問(YesNo),信頼
まず英語から始める。,まず英語からですか。,質問(YesNo),質問(YesNo),信頼
だよね。そう思う。,でも、教えるんだよね、そう。,質問(YesNo),質問(YesNo),信頼
ね、ま、だから、それで別に答え合わせする必要もないかなとは思うだけどさ、全体的に、全体にどういう、なんか、なんていうのかな、流れ、にしたらいいのかもね。だから、そもそもさ、だからああやってつくるのは、いろんな字でつくるのは簡単なんだけど。,うん、まず字やっておいて、どこがちらちらっと見えるかっていうふうにやればいいわけでしょう。,質問(YesNo),質問(YesNo),信頼
はい？,チーズケーキですか、これ。,質問(YesNo),質問(YesNo),信頼
ＭＡＬＩＣＥは、ドイツ語だと思う。,へー、じゃあ、ＭＡＬＩＣＥ何とかって、悪意何とかって意味なの。,質問(YesNo),質問(YesNo),信頼
「マテリアル・ガール」ってものを与えることで満足する女って意味。うんうん。,「マテリアル・ガール」だって、「ライク・ア・バージン」だっけ、歌ったの。,質問(YesNo),自己開示,信頼
ほんとほんと。,「ライク・ア・バージン」だっけ、入ってるの。,質問(YesNo),質問(YesNo),信頼
うん。,なんも考えんと、飲ま、入れんと飲んでしまった。かわいい。＜間＞持って来たの見てもいい？,質問(YesNo),自己開示,信頼
うん。書き方として。,それは、ユングの自伝？,質問(YesNo),質問(YesNo),信頼
無の領域に近づけていくっていう禅なんかあるだけど。あれやっている人は、やっている途中に、幻ぽいの見るみたい。,ああ、見るって。,質問(YesNo),質問(YesNo),信頼
東京からね、わざわざね。,京都に来たいって？,質問(YesNo),質問(YesNo),信頼
ああ、そっか、そっか。じゃ、わりと機能みたいな感じなんだね。,きのう？,質問(YesNo),質問(YesNo),信頼
学部の３年生の春休みに、初めてフランスに行ったの。２年間、学部の一般教養で受けてたんだけど、フランス語の授業を。ま、もちろんさー、全然話せないわけよ。そういう状況で留学に行ったわけよ。,うん。学部の授業とは、やっぱ違うわけ？,質問(YesNo),あいづち,信頼
やっぱ違う。そうだね。学部でやるのはさー、結構、うん、文法事項を先生が説明してくれて、で、例文読んで、で、そのあと問題やってっていうさ、もうほんと、テキストに沿って進んでいくっていうさ、そういう感じなのね。口頭練習とかはね、あと聞く練習とか、ほっとんどなかったの。,え、ないっていうのは？語学学校で？,質問(YesNo),質問(What),信頼
そっか、そっか。へー。うーん、そっかー。,これって途中で１回切って、はぎ合わせるとか、だめなの？,質問(YesNo),質問(YesNo),信頼
うん。そうそうそう。,私立なの？,質問(YesNo),質問(YesNo),信頼
